{
  "schema": "omdsh-workshop-real-project-review/v1",
  "id": "time-capsule-mcp",
  "releaseId": "time-capsule-mcp@0.1.0-rc.1",
  "source": {
    "repository": "https://github.com/omdsh-dev/toybox",
    "ref": "fdace9d6ca01e31b33a08ed0703964b1ad6b3be0",
    "path": "/plugins/time-capsule-mcp/.dsh-plugin",
    "packagePath": "plugins/time-capsule-mcp/.dsh-plugin/package.json",
    "publiclyReachable": true,
    "observedDefaultHead": "fdace9d6ca01e31b33a08ed0703964b1ad6b3be0",
    "tree": "afd98ed6b03fafaf352de38656f161fe4800d11b"
  },
  "catalog": {
    "version": "0.0.1",
    "license": "MIT",
    "kind": "mcp",
    "legacyManagement": "repository-plugin"
  },
  "package": {
    "name": "time-capsule-mcp",
    "version": "0.1.0-rc.1",
    "license": "MIT",
    "private": true,
    "workshopManifest": "absent",
    "legacySignals": [
      "dsh.mcpServers:.mcp.json"
    ],
    "lifecycleScripts": [
      "prepare"
    ]
  },
  "sequence": [
    {
      "stage": "fixed-source",
      "state": "passed",
      "reason": "Anonymous public Git fetch resolved the exact commit and tree afd98ed6b03fafaf352de38656f161fe4800d11b."
    },
    {
      "stage": "type-plan",
      "state": "blocked",
      "reason": "A valid author-declared package.json#dshWorkshop and matching release facts are required."
    },
    {
      "stage": "trust-review",
      "state": "completed",
      "reason": "Assisted static review recorded 4 finding(s) without executing source code."
    },
    {
      "stage": "adapter",
      "state": "blocked",
      "reason": "Source execution requires a separate explicit human trust decision after a valid type plan."
    },
    {
      "stage": "evidence",
      "state": "saved",
      "reason": "Pre-admission review evidence is stored at intake/reviews/time-capsule-mcp@0.1.0-rc.1.json."
    },
    {
      "stage": "human-review",
      "state": "pending",
      "reason": "Independent maintainer review has not been recorded."
    },
    {
      "stage": "admission",
      "state": "not-created",
      "reason": "Admission is a separate explicit change after approved review and passing Harness evidence."
    }
  ],
  "typePlan": {
    "state": "blocked",
    "declaredProtocol": null,
    "declaredAdapter": null,
    "observedLegacyProtocol": "harness-repository",
    "observedLegacyAdapter": "repository-plugin",
    "migrationOptions": [
      "Declare the legacy package honestly as harness-repository/repository-plugin, or publish a current MCP server.json and migrate to mcp/mcp-server."
    ],
    "reason": "package.json#dshWorkshop is absent"
  },
  "trustReview": {
    "state": "needs-fix",
    "method": "assisted-static-public-source-review",
    "sourceExecutionAuthorized": false,
    "checks": {
      "publicCommit": "passed",
      "packageJson": "passed",
      "workshopManifest": "failed",
      "catalogVersion": "failed",
      "license": "passed",
      "artifact": "passed",
      "credentials": "passed",
      "symlinkContainment": "passed",
      "nativeCode": "passed",
      "lifecycleScripts": "review-required",
      "processExecutionIntent": "passed",
      "rc6Baseline": "blocked"
    },
    "findings": [
      {
        "severity": "blocker",
        "code": "workshop-manifest-absent",
        "evidence": "package.json#dshWorkshop is absent"
      },
      {
        "severity": "blocker",
        "code": "catalog-version-mismatch",
        "evidence": "Catalog 0.0.1; fixed package.json 0.1.0-rc.1."
      },
      {
        "severity": "review",
        "code": "package-lifecycle-scripts",
        "evidence": "Lifecycle scripts present: prepare. They were not executed and must remain disabled until reviewed."
      },
      {
        "severity": "blocker",
        "code": "repository-plugin-contract-unavailable",
        "evidence": "The current public RC.6 baseline does not expose the legacy Repository Plugin contract."
      }
    ]
  },
  "adapter": {
    "state": "blocked",
    "name": "repository-plugin",
    "reason": "Typed Harness plan is blocked; project code was not executed.",
    "report": null
  },
  "humanReview": {
    "state": "pending",
    "reviewer": null,
    "reason": "The generated assisted review cannot approve its own independent human gate."
  },
  "admission": {
    "state": "not-created",
    "reason": "No approved human review or passing RC.6 Harness report exists for this fixed release."
  },
  "claims": {
    "rc6Verified": false,
    "seamlessInstall": "unknown",
    "failureIsolation": "unknown",
    "hotReload": "unknown"
  },
  "reviewedAt": "2026-08-14T07:27:57.043Z",
  "reviewer": "codex-assisted-pre-admission-review"
}
